{
  "$id": "https://edge-finder.app/schemas/edge_finder.app.v1/ranking",
  "$schema": "https://json-schema.org/draft/2020-12/schema",
  "additionalProperties": false,
  "properties": {
    "as_of": {
      "description": "ISO-8601 UTC, Z suffix",
      "format": "date-time",
      "type": "string"
    },
    "entries": {
      "description": "sorted by rank ascending; rank 1 is best per higher_is_better",
      "items": {
        "additionalProperties": false,
        "properties": {
          "adjusted_value": {
            "type": [
              "number",
              "null"
            ]
          },
          "display_name": {
            "type": "string"
          },
          "entity_id": {
            "description": "a contract id",
            "pattern": "^[a-z]{2,4}_[A-Za-z0-9._-]{4,}$",
            "type": "string"
          },
          "path": {
            "type": [
              "string",
              "null"
            ]
          },
          "percentile": {
            "type": [
              "number",
              "null"
            ]
          },
          "rank": {
            "minimum": 1,
            "type": "integer"
          },
          "sample_size": {
            "description": "",
            "type": [
              "integer",
              "null"
            ]
          },
          "short_name": {
            "type": [
              "string",
              "null"
            ]
          },
          "value": {
            "type": [
              "number",
              "null"
            ]
          }
        },
        "required": [
          "adjusted_value",
          "display_name",
          "entity_id",
          "path",
          "percentile",
          "rank",
          "sample_size",
          "short_name",
          "value"
        ],
        "type": "object"
      },
      "type": "array"
    },
    "generated_at": {
      "description": "ISO-8601 UTC, Z suffix",
      "format": "date-time",
      "type": "string"
    },
    "higher_is_better": {
      "type": [
        "boolean",
        "null"
      ]
    },
    "kind": {
      "const": "ranking"
    },
    "links": {
      "items": {
        "additionalProperties": false,
        "description": "a navigable edge; every path must exist in explorer/index.json",
        "properties": {
          "label": {
            "type": "string"
          },
          "path": {
            "description": "app-root-relative path of the target document; null only when the target is embedded",
            "type": [
              "string",
              "null"
            ]
          },
          "rel": {
            "enum": [
              "TEAM",
              "PLAYER",
              "EVENT",
              "OPPONENT",
              "METRIC",
              "RANKING",
              "SERIES",
              "MARKET",
              "MARKET_HISTORY",
              "EVENT_RESEARCH",
              "CAPABILITIES",
              "SEARCH",
              "INDEX"
            ],
            "type": "string"
          },
          "target_id": {
            "description": "the contract id of the target, when it has one",
            "type": [
              "string",
              "null"
            ]
          },
          "target_kind": {
            "enum": [
              "manifest",
              "events",
              "markets",
              "model_prices",
              "recommendations",
              "theses",
              "wagers",
              "settlements",
              "runs",
              "health",
              "board",
              "event_detail",
              "performance",
              "router_health",
              "recent_deliveries",
              "sports_registry",
              "explorer_index",
              "capability_manifest",
              "metric_registry",
              "entity_profile",
              "event_research",
              "ranking",
              "time_series",
              "market_history",
              "search_index",
              "handicap_packet",
              "handicap_protocol",
              "research_tray"
            ],
            "type": "string"
          }
        },
        "required": [
          "label",
          "path",
          "rel",
          "target_id",
          "target_kind"
        ],
        "type": "object"
      },
      "type": "array"
    },
    "metric_id": {
      "description": "met_<sport>.<slug>",
      "pattern": "^met_[a-z]+\\.[a-z0-9_]+$",
      "type": "string"
    },
    "quality": {
      "additionalProperties": false,
      "description": "where a research object came from and how far to trust it",
      "properties": {
        "coverage": {
          "description": "human-readable span, e.g. 2026 weeks 1-4",
          "type": [
            "string",
            "null"
          ]
        },
        "data_as_of": {
          "description": "the newest underlying observation",
          "format": "date-time",
          "type": [
            "string",
            "null"
          ]
        },
        "generated_at": {
          "description": "ISO-8601 UTC, Z suffix",
          "format": "date-time",
          "type": "string"
        },
        "limitations": {
          "description": "known caveats, verbatim from the audit; never empty for PARTIAL/RESEARCH",
          "items": {
            "type": "string"
          },
          "type": "array"
        },
        "methodology_version": {
          "type": [
            "string",
            "null"
          ]
        },
        "missingness": {
          "description": "fraction of expected observations that are absent, 0..1",
          "type": [
            "number",
            "null"
          ]
        },
        "production": {
          "description": "produced by a scheduled production path, not a notebook or one-off",
          "type": "boolean"
        },
        "sample_size": {
          "description": "",
          "type": [
            "integer",
            "null"
          ]
        },
        "source": {
          "description": "the producing dataset or provider, e.g. nflverse pbp, kalshi captures, internal simulation",
          "type": "string"
        },
        "source_version": {
          "type": [
            "string",
            "null"
          ]
        },
        "status": {
          "description": "VERIFIED = production-generated on a cadence, tested, history present; PARTIAL = real but limited; RESEARCH = non-production or experimental; UNAVAILABLE = nothing supports it; UNKNOWN = not established",
          "enum": [
            "VERIFIED",
            "PARTIAL",
            "RESEARCH",
            "UNAVAILABLE",
            "UNKNOWN"
          ],
          "type": "string"
        }
      },
      "required": [
        "coverage",
        "data_as_of",
        "generated_at",
        "limitations",
        "methodology_version",
        "missingness",
        "production",
        "sample_size",
        "source",
        "source_version",
        "status"
      ],
      "type": "object"
    },
    "ranking_id": {
      "description": "a contract id",
      "pattern": "^[a-z]{2,4}_[A-Za-z0-9._-]{4,}$",
      "type": "string"
    },
    "run_id": {
      "description": "a contract id",
      "pattern": "^[a-z]{2,4}_[A-Za-z0-9._-]{4,}$",
      "type": "string"
    },
    "schema_version": {
      "const": "edge_finder.app.v1"
    },
    "split": {
      "anyOf": [
        {
          "additionalProperties": false,
          "properties": {
            "dimension": {
              "description": "home_away, handedness, strength_state, surface ...",
              "type": "string"
            },
            "value": {
              "type": "string"
            }
          },
          "required": [
            "dimension",
            "value"
          ],
          "type": "object"
        },
        {
          "type": "null"
        }
      ]
    },
    "sport": {
      "description": "canonical sport",
      "enum": [
        "MLB",
        "CFB",
        "NFL",
        "NBA",
        "NHL",
        "SOCCER",
        "TENNIS"
      ],
      "type": "string"
    },
    "summary": {
      "additionalProperties": false,
      "properties": {
        "best_entity_id": {
          "pattern": "^[a-z]{2,4}_[A-Za-z0-9._-]{4,}$",
          "type": [
            "string",
            "null"
          ]
        },
        "max": {
          "type": [
            "number",
            "null"
          ]
        },
        "mean": {
          "type": [
            "number",
            "null"
          ]
        },
        "median": {
          "type": [
            "number",
            "null"
          ]
        },
        "min": {
          "type": [
            "number",
            "null"
          ]
        },
        "sample_size_max": {
          "description": "",
          "type": [
            "integer",
            "null"
          ]
        },
        "sample_size_min": {
          "description": "",
          "type": [
            "integer",
            "null"
          ]
        },
        "stdev": {
          "type": [
            "number",
            "null"
          ]
        },
        "worst_entity_id": {
          "pattern": "^[a-z]{2,4}_[A-Za-z0-9._-]{4,}$",
          "type": [
            "string",
            "null"
          ]
        }
      },
      "required": [
        "best_entity_id",
        "max",
        "mean",
        "median",
        "min",
        "sample_size_max",
        "sample_size_min",
        "stdev",
        "worst_entity_id"
      ],
      "type": "object"
    },
    "universe": {
      "additionalProperties": false,
      "properties": {
        "entity_type": {
          "enum": [
            "TEAM",
            "PLAYER",
            "EVENT",
            "MARKET",
            "MATCHUP"
          ],
          "type": "string"
        },
        "filter": {
          "type": [
            "string",
            "null"
          ]
        },
        "label": {
          "type": "string"
        },
        "season": {
          "type": [
            "string",
            "null"
          ]
        },
        "size": {
          "minimum": 0,
          "type": "integer"
        }
      },
      "required": [
        "entity_type",
        "filter",
        "label",
        "season",
        "size"
      ],
      "type": "object"
    },
    "window": {
      "additionalProperties": false,
      "properties": {
        "end": {
          "description": "ISO-8601 UTC, Z suffix, or null",
          "format": "date-time",
          "type": [
            "string",
            "null"
          ]
        },
        "kind": {
          "enum": [
            "SEASON",
            "LAST_N",
            "DATE_RANGE",
            "GAME",
            "RUN",
            "CUSTOM"
          ],
          "type": "string"
        },
        "label": {
          "description": "SEASON, L3, L5, 2026-W04, run 2026-10-02T14:40Z ...",
          "type": "string"
        },
        "n": {
          "description": "LAST_N size",
          "type": [
            "integer",
            "null"
          ]
        },
        "start": {
          "description": "ISO-8601 UTC, Z suffix, or null",
          "format": "date-time",
          "type": [
            "string",
            "null"
          ]
        }
      },
      "required": [
        "end",
        "kind",
        "label",
        "n",
        "start"
      ],
      "type": "object"
    }
  },
  "required": [
    "as_of",
    "entries",
    "generated_at",
    "higher_is_better",
    "kind",
    "links",
    "metric_id",
    "quality",
    "ranking_id",
    "run_id",
    "schema_version",
    "split",
    "sport",
    "summary",
    "universe",
    "window"
  ],
  "title": "ranking",
  "type": "object"
}
