{"as_of":"2026-06-14T00:30:00Z","entries":[{"adjusted_value":null,"display_name":"Dallas Mavericks","entity_id":"prt_fe5481634395448d9b19","path":"explorer/teams/prt_fe5481634395448d9b19.json","percentile":100.0,"rank":1,"sample_size":5,"short_name":"DAL","value":64.0},{"adjusted_value":null,"display_name":"Miami Heat","entity_id":"prt_a2f709f064ade0ae42ae","path":"explorer/teams/prt_a2f709f064ade0ae42ae.json","percentile":96.67,"rank":2,"sample_size":5,"short_name":"MIA","value":59.4},{"adjusted_value":null,"display_name":"New Orleans Pelicans","entity_id":"prt_eca66c83035c7ac78937","path":"explorer/teams/prt_eca66c83035c7ac78937.json","percentile":96.67,"rank":2,"sample_size":5,"short_name":"NOP","value":59.4},{"adjusted_value":null,"display_name":"Utah Jazz","entity_id":"prt_e19c178a6af1e6318e53","path":"explorer/teams/prt_e19c178a6af1e6318e53.json","percentile":90.0,"rank":4,"sample_size":5,"short_name":"UTA","value":58.4},{"adjusted_value":null,"display_name":"Milwaukee Bucks","entity_id":"prt_8848b90e0c224d6f089f","path":"explorer/teams/prt_8848b90e0c224d6f089f.json","percentile":86.67,"rank":5,"sample_size":5,"short_name":"MIL","value":58.0},{"adjusted_value":null,"display_name":"Memphis Grizzlies","entity_id":"prt_8a704689b01aa193ff6a","path":"explorer/teams/prt_8a704689b01aa193ff6a.json","percentile":83.33,"rank":6,"sample_size":5,"short_name":"MEM","value":57.8},{"adjusted_value":null,"display_name":"Indiana Pacers","entity_id":"prt_65afa15e60116e2eb6cf","path":"explorer/teams/prt_65afa15e60116e2eb6cf.json","percentile":80.0,"rank":7,"sample_size":5,"short_name":"IND","value":57.6},{"adjusted_value":null,"display_name":"Sacramento Kings","entity_id":"prt_8db71d6157e00de360ed","path":"explorer/teams/prt_8db71d6157e00de360ed.json","percentile":76.67,"rank":8,"sample_size":5,"short_name":"SAC","value":57.4},{"adjusted_value":null,"display_name":"Orlando Magic","entity_id":"prt_0abf86a550a6455440e5","path":"explorer/teams/prt_0abf86a550a6455440e5.json","percentile":73.33,"rank":9,"sample_size":5,"short_name":"ORL","value":56.8},{"adjusted_value":null,"display_name":"Chicago Bulls","entity_id":"prt_f13ce07bb0c6e2821fd1","path":"explorer/teams/prt_f13ce07bb0c6e2821fd1.json","percentile":70.0,"rank":10,"sample_size":5,"short_name":"CHI","value":56.6},{"adjusted_value":null,"display_name":"San Antonio Spurs","entity_id":"prt_4a364ab396771a61dc43","path":"explorer/teams/prt_4a364ab396771a61dc43.json","percentile":66.67,"rank":11,"sample_size":5,"short_name":"SAS","value":56.4},{"adjusted_value":null,"display_name":"LA Clippers","entity_id":"prt_f10ad2b151b0d20f9905","path":"explorer/teams/prt_f10ad2b151b0d20f9905.json","percentile":63.33,"rank":12,"sample_size":5,"short_name":"LAC","value":55.6},{"adjusted_value":null,"display_name":"Philadelphia 76ers","entity_id":"prt_46f312ddd6a2b4c85b51","path":"explorer/teams/prt_46f312ddd6a2b4c85b51.json","percentile":60.0,"rank":13,"sample_size":5,"short_name":"PHI","value":55.4},{"adjusted_value":null,"display_name":"Toronto Raptors","entity_id":"prt_a6314eb751a98f8e15dd","path":"explorer/teams/prt_a6314eb751a98f8e15dd.json","percentile":56.67,"rank":14,"sample_size":5,"short_name":"TOR","value":55.2},{"adjusted_value":null,"display_name":"Portland Trail Blazers","entity_id":"prt_68d6b3ae923a6cb79072","path":"explorer/teams/prt_68d6b3ae923a6cb79072.json","percentile":53.33,"rank":15,"sample_size":5,"short_name":"POR","value":54.8},{"adjusted_value":null,"display_name":"Charlotte Hornets","entity_id":"prt_61db3f7d185c7bd9ebae","path":"explorer/teams/prt_61db3f7d185c7bd9ebae.json","percentile":50.0,"rank":16,"sample_size":5,"short_name":"CHA","value":54.4},{"adjusted_value":null,"display_name":"Oklahoma City Thunder","entity_id":"prt_5bcdc9aab9018ae9d861","path":"explorer/teams/prt_5bcdc9aab9018ae9d861.json","percentile":46.67,"rank":17,"sample_size":5,"short_name":"OKC","value":54.2},{"adjusted_value":null,"display_name":"Phoenix Suns","entity_id":"prt_a636e92b2231370b0573","path":"explorer/teams/prt_a636e92b2231370b0573.json","percentile":46.67,"rank":17,"sample_size":5,"short_name":"PHX","value":54.2},{"adjusted_value":null,"display_name":"Denver Nuggets","entity_id":"prt_445e1bbd0aaf86ba4e17","path":"explorer/teams/prt_445e1bbd0aaf86ba4e17.json","percentile":40.0,"rank":19,"sample_size":5,"short_name":"DEN","value":53.4},{"adjusted_value":null,"display_name":"Boston Celtics","entity_id":"prt_4ed4536746d4d8a7e308","path":"explorer/teams/prt_4ed4536746d4d8a7e308.json","percentile":36.67,"rank":20,"sample_size":5,"short_name":"BOS","value":53.2},{"adjusted_value":null,"display_name":"Detroit Pistons","entity_id":"prt_07dd7ff0303300042ef6","path":"explorer/teams/prt_07dd7ff0303300042ef6.json","percentile":33.33,"rank":21,"sample_size":5,"short_name":"DET","value":53.0},{"adjusted_value":null,"display_name":"Los Angeles Lakers","entity_id":"prt_0a96c4404fea2e23ae2a","path":"explorer/teams/prt_0a96c4404fea2e23ae2a.json","percentile":30.0,"rank":22,"sample_size":5,"short_name":"LAL","value":52.8},{"adjusted_value":null,"display_name":"Cleveland Cavaliers","entity_id":"prt_cf3e69af6b9aee3f7449","path":"explorer/teams/prt_cf3e69af6b9aee3f7449.json","percentile":30.0,"rank":22,"sample_size":5,"short_name":"CLE","value":52.8},{"adjusted_value":null,"display_name":"Brooklyn Nets","entity_id":"prt_a447af57f9c13a0f66a5","path":"explorer/teams/prt_a447af57f9c13a0f66a5.json","percentile":23.33,"rank":24,"sample_size":5,"short_name":"BKN","value":52.0},{"adjusted_value":null,"display_name":"Minnesota Timberwolves","entity_id":"prt_6e7f599ec595aefbe5d8","path":"explorer/teams/prt_6e7f599ec595aefbe5d8.json","percentile":20.0,"rank":25,"sample_size":5,"short_name":"MIN","value":50.8},{"adjusted_value":null,"display_name":"New York Knicks","entity_id":"prt_c4ff37543dddefb5d9d5","path":"explorer/teams/prt_c4ff37543dddefb5d9d5.json","percentile":20.0,"rank":25,"sample_size":5,"short_name":"NYK","value":50.8},{"adjusted_value":null,"display_name":"Washington Wizards","entity_id":"prt_d31031bae5a4dd57795a","path":"explorer/teams/prt_d31031bae5a4dd57795a.json","percentile":13.33,"rank":27,"sample_size":5,"short_name":"WAS","value":49.8},{"adjusted_value":null,"display_name":"Golden State Warriors","entity_id":"prt_e185778af25c099f61e1","path":"explorer/teams/prt_e185778af25c099f61e1.json","percentile":10.0,"rank":28,"sample_size":5,"short_name":"GSW","value":49.2},{"adjusted_value":null,"display_name":"Houston Rockets","entity_id":"prt_154c9a432d4539fabeea","path":"explorer/teams/prt_154c9a432d4539fabeea.json","percentile":6.67,"rank":29,"sample_size":5,"short_name":"HOU","value":48.2},{"adjusted_value":null,"display_name":"Atlanta Hawks","entity_id":"prt_cb335b403343d076dc0e","path":"explorer/teams/prt_cb335b403343d076dc0e.json","percentile":3.33,"rank":30,"sample_size":5,"short_name":"ATL","value":48.0}],"generated_at":"2026-10-28T17:03:51Z","higher_is_better":true,"kind":"ranking","links":[{"label":"metric registry","path":"explorer/metrics.json","rel":"METRIC","target_id":"met_nba.team_first_half_pts","target_kind":"metric_registry"}],"metric_id":"met_nba.team_first_half_pts","quality":{"coverage":"3 seasons, 2023-10-05..2026-06-13","data_as_of":"2026-06-14T00:30:00Z","generated_at":"2026-10-28T17:03:51Z","limitations":["Nothing that feeds the research tables runs on a schedule; the ESPN history was last pulled 2026-09-19 (box scores) and 2026-09-29 (shot events), Kalshi history 2026-09-19.","Only persisted per run in `slates/*/packet.json` `home/away` blocks; never as a series (derived here on export by arithmetic over stored rows)","preseason excluded (systems validation only)","per-entity series capped at the last 82 games; profile game lists at the last 20 (the full stored log is in extensions.game_log)"],"methodology_version":"nba_edge.research_export/1.0.0 (nba-edge-finder 0.1.0)","missingness":null,"production":false,"sample_size":8320,"source":"ESPN box scores (data/history/espn, `nba history`)","source_version":"2026-09-19T00:37:29Z","status":"PARTIAL"},"ranking_id":"rnk_66802e0da9bd9c926d93","run_id":"run_97012827cfe2d23aa505","schema_version":"edge_finder.app.v1","split":null,"sport":"NBA","summary":{"best_entity_id":"prt_fe5481634395448d9b19","max":64.0,"mean":54.653333,"median":54.6,"min":48.0,"sample_size_max":5,"sample_size_min":5,"stdev":3.590333,"worst_entity_id":"prt_cb335b403343d076dc0e"},"universe":{"entity_type":"TEAM","filter":"each team's last 5 non-preseason games","label":"NBA teams, last 5 non-preseason games","season":"2025-26","size":30},"window":{"end":null,"kind":"LAST_N","label":"L5","n":5,"start":null}}
